{
  "$schema": "https://anthropic.com/claude-code/marketplace.schema.json",
  "name": "orchestkit",
  "version": "4.28.2",
  "description": "The Complete AI Development Toolkit â€” 159 skills, 34 agents, 20 commands, 141 hooks for full-stack development",
  "owner": {
    "name": "Yonatan Gross",
    "email": "yonatan2gross@gmail.com"
  },
  "plugins": [
    {
      "name": "ork",
      "description": "Complete AI development toolkit with 159 skills covering AI/LLM, backend, frontend, security, and testing patterns. Includes 34 specialized agents, 20 commands, and 144 lifecycle hooks.",
      "version": "4.28.2",
      "author": {
        "name": "Yonatan Gross",
        "email": "yonatan2gross@gmail.com"
      },
      "source": "./",
      "category": "development"
    }
  ]
}
